target_sentence,source_sentence
@AndrsGomezV: Algunas dudas #uranio: hasta ahora ningún experto lo vio ni certificó y si era tan radiactivo ¿por que transportaron como si fuera arena?,"@ mrduranch: @ Fer _ SanMartin ¿fuente? # uranio? ukax mä recipiente de plomo ukar suma imataw apanaqasiñapa, jan walt 'ayiriwa."
"No había referencias a pueblos tribales ni indígenas en la primera Constitución de Bangladesh de 1972, donde se mencionaba que Bangladesh sería la tierra de los bengalíes.",Aka jamuqanxa taqi uka nayratpacha aka uraqinkiranakawa walpun ch ’ axwir mistuwayapxatayna.
"Del sitio web: ""Juntos por un trânsito más humano, por ciudades más bonitas y alegres, por un mundo más respirable: todos somos parte de Massa Crítica"".","Mä Massa Critica laphi uñjañatakiw Aka sitio web ukaxa: taqina taqpachani sartasiñasataki juk ´ ampi jaqiñasataki, aka mark juq ´ amp jiwakiñapataki ukhamaraki markpach sum samsuñataki taqiniw aka Massa Critica tuqinktanxa."
"La investigación, a cargo de Microsoft Research, examina las prácticas de intercambio de información por parte de las personas que viven en ciudades en conflicto por la guerra contra las drogas en México.","Yatxatawixa, Microsoft Research ukana, yatintirinakax yatiyawinak turkt ’ asaw yatxatapxi, ukatx markanakan jakir jaqinakax Mexiconx yanqhaqullanaktuq ch ’ axwasaw jakapxi."
"De esa manera, también estás defendiendo a Internet. #NoTemasaInternet",Internetarus # NoTemasaInternet arxataskaraktawa.
Esto es lo que Oscar Montezuma pregunta en el blog Blawyer.,Akx Oscar Montezuma jilaw blogupan Blawyer jiskt 'asi.
Las escuelas de Ciudad Isa se dirigieron al Ministerio de Educación entre peticiones de dimisión del ministro de educación y protestas por el sistema de profesores voluntarios adoptado cuando los profesores se declararon en huelga para apoyar a los manifestantes de la Glorieta Perla y los mártires caídos.,Markanakankir yatiñ utanakatx Ministerio de Educación tuqiruw sarapxi.yatichirinakax Glorieta Perlan ch 'axwawin jikjatasipk ukanakar yanapt 'añatakiw manq 'at mutuñar mantapxi.
"RFI se centra en la programación interactiva, con citas y debates acerca de las políticas y de los productos entre los agricultores locales, no es sólo información de arriba hacia abajo.","RFI wali kuskawa, kunatix utjiwa: tantachawi, aka politicas ukat productos ukanak arusqiptañanaka marqachirinakatak utjäna."
A continuación aparecen algunas imágenes de aves de la página de Facebook de Arnold:,Gitagum jisk 'a markax Laguindingán marka jak 'an jikxatasi:
La palestina Ola Anan tuitea:,Palestino-nkir Ola Anan-ax akjam siwa:
"Varias organizaciones de derechos humanos y defensores individuales de diferentes sectores están detrás de este sitio web donde trabajan juntos para ofrecer a las víctimas de tortura asesoría psicológica y legal, exponiendo más incidentes, llegando a organizaciones de medios tradicionales y creando conciencia en el público acerca de los casos y sus repercusiones.","Jan walt ’ ayat k ’ uk ’ ux Edmad El Kebir satawa, Islan Nabih ukatx Reda Fathi jupanakax t ’ aqisiyata, jan walt ’ ayatapxanwa, vedeo satax uñacht ’ ayatañapawa, ukatx palla pallanakax justiciatuqir jaysapxañapatakiw irpatapxäna."
"Tenemos diferentes tipos de canales: el boletin, el sitio web y nuestra lista de correo.","Walja kast canalanakaw utjapxitu: boletín, sitio web ukat nanakan correo qillqatanaka."
La euforia duró poco.,Mä juk 'a pachakiw phiñasiwix utjäna.
Fotografía de Akaneto.,Aka jamuqax Akaneto-n apsutawa.
"Sudanese Optimist está contento por Sudán del Sur, pero...:",Ukawa wali aski nä pachpataki.
"Tras ser puesta en libertad en el área protegida Salugah y Ghazal hace varios días, Menes voló hacia una cercana isla del Nilo, Donde la capturaron y mataron para comérsela después.","Yatiyawix Menes ukanakarux jan walt 'ayatynawa, Salugah ukat Ghazal ukan Menes ukanakax thuqtawayapxatayna, isla de Nilo uksaruw puripxatayna, kawkhanti katurapkan ukat manq 'antañatak jiwayapkan ukaruw puripxatayna."
"Según informes de prensa, este actual ataque ha cobrado las vida de 13 gazatíes y de 3 israelíes.",Kunawsatix masürunx uka markan jupax mä lata jamach ’ inkaskän ukjaw jiwayapxi.
Hong Kong: Los gastos de la abuela,Hong Kong: Awichan taqikunatak qullqi munatapa
Mientras que El gato (@elgatoninja) tuitea con ironía:,(@ elgatoninja) phiñasitaw tuytiyi:
"Foto: Calé, publicación autorizada.","Jamuqa: Calé, qhanstayawix yatiyatawa."
Cualquiera puede hacer uso del servicio llamándo a alguno de los siguientes números internacionales y dejando un mensaje de voz: +16504194196 o +390662207294 o +97316199855.,Taqinisa aru tuq arsusiñatakix aka jakhuwinak tuqiru jawsant 'anipxaspawa: + 16504194196 or + 390662207294 or + 97316199855.
Se puede ver más en su blog.,Juk 'ampix blogupan uñjasi.
Enseño en algunas escuelas de la ciudad y la respuesta ha sido buena.,arumpits yatiqirinakar yaticht ’ i ukhamat “jan callenakan uthañpataki ”.
"Si queremos ser el mejor país del mundo, necesitamos jóvenes con educación. #JuventudAzul por más becas y más oportunidades. — Ramsés Mejía (@ramsesmejia) November 16, 2013",Jiwasatix jach ’ a markañ munañani ukax wayn tawaqunaqax suma amuyuniñpaw. # JuventudAzul juk ’ amp becanak utjañapatak. — Ramsés Mejía (@ ramsesmejia) tunka suxtan urunak sarakpan lapaq phaxsitx pä waranqa tunka kimsan marata
"Michael Hanna, un bloguero y farmacéutico egipcio, continuó su serie de lamentos no sólo por el asesinato de árboles sino también por la demolición de villas antiguas en el suburbio de Heliopolis de El Cairo, y escribió una oda a una palmera.","Michael Hanna, egipcionkir bloguero ukatx farmacéutico jilax qillqt 'iwa El Cairo, uksan mä palmera"
"Hubo un problema que estropeó la ceremonia de traspaso de poder del Consejo Nacional de Transición de Libia (NTC, sus siglas en inglés) al recientemente elegido Congreso General Nacional libio de 200 miembros: la maestra de ceremonias era Sarah Elmesallati, que no usaba velo, y a quien se ordenó abandonar el escenario después que un parlamentario islamista saliera de la ceremonia en protesta por ser ella la presentadora de la histórica ceremonia.","Mä jan walt ’ äwiw q ’ al mayjt ’ ay Consejo Nacional de Transición Libiatuqina (NTC, ingles arut jisk ’ aptayäwi) jichha Congreso General Nacional libio 200 chhijllt ’ atanakan ceremonia maynit maynir turkakipäwi (traspaso de poder): Uka nayrar sarantayirix janiw velo ukanikiti kullaka Sarah Elmesallati-nwa, ukat jaqsutän kunatix mä parlamentario islamista ukan mistuwixan aka jach ’ a ceremoniat wali thithit kullak uñjasax."
"A lo largo del día, los expositores evaluaron la cultura y las perspectivas en materia de privacidad a lo largo de todo el mundo.","Mä urunaki yatirir jaqinakax markanakan yatiyawipa, kunjams taqpach markanakan jaqinakan luratapat yatiyiri ukanak yatxañatakina."
Chile: Protesta estudiantil por reducción de horas de Ciencias Sociales,Chile: Yatiqirinakan Arsusipxatapa Ciencias Sociales Uka Yatichäwin Pachanak Pisiqtayataplayku
Y Majed Abusalama añade:,MajedAbusalama saraki:
Celebración en Laheh Park en Teherán,Laheh Park Teherán markan amtkasa
GV Face: Sueños de reforma migratoria de Estados Unidos,GV FACE: Reforma migratoriatuqin samkapa khaysa Estados Unidostuqina
"Nosotros, los campesinos pobres, condenamos la manera en que se diseñó el programa pro SABANA y la manera en que se pretende implementarlo en Mozambique, ya que faltó transparencia y se excluyó a las organizaciones civiles del proceso, sobre todo a las organizaciones de campesinos.","Nänaka, pisina jakasirinakaxa, pro SABANA ukan amtawinakaparux qhurumpiw kutiyata, kunjamtix Mozambique ukan lurañ munapk ukata, janiw qhanstayatakanti, ukat niyakixay markanakan tantacht ’ atapx ukanakarus ukat pisina jakiri tantacht ’ asitanakarus jaqsupxstaxa sasa."
Camerún: Policía usa violencia contra los manifestantes,Camerún: Palla Pallanakax Markachirinakaruw Jan Wali Usuchnuqawapxi
Existen aplicaciones y plugins desarrollados por terceros para ayudar a que los hablantes nativos se sientan más cómodos con sus smartphones.,Utjiw apnaqäwinak ukhamarak plugin-nanaka kimsirinakan lurata nativo-nakar yanapt ’ añatak ukat jasak smartphones. apnaqapxañapataki.
"Horacio Duque, en Tercera Información, se pregunta si el cese al fuego unilateral de las FARC ha funcionado (enlace insertado por GV):",Horacio Duquex kimsïr yatiyawin jiskt ’ asiwa aka unilateralxat ukar Farc ukampita:
Vimos este error común y nos dimos cuenta de que era una plataforma para empezar a actualizar la visión del mundo a lo que está ocurriendo en nuestro país.,Uñjapta aka pantjäwita ukat sisnawa aka plataformampix qalltañaniw actualizañ mundoruw uñjañaxa kuns markasarun sartaski.
Lo ocurrido hoy en #Pemex no es chiste.,Kunatix jichhürux Pemexan # Pemex atki ukax janiw sawkakiti sasa.
"Teniendo esto en cuenta, numerosos grupos se han unido recientemente para redactar una Declaración por la Libertad de Internet, de la que Global Voices Advocacy ha sido uno de los firmantes originales.","Jichhakiw tamanakax mayacht ’ asipxi Declaración por la Libertad de Internet uka qilqt 'añataki, ukanx Global Voices Advocacy ukax nayrïr rixuntiriwa."
"También se puede visitar el blog para enterarse de las últimas novedades e ideas, y seguirlos en Twitter @NoSomosHormigas.",Twitter tuqins arkaraksnawa @ NoSomosHormigas-Janiw k ’ isimiriktanti.
"En Twitter también hubo comentarios referidos a la Fiesta del Sol, como el de Kristell PerezAlbela (@Kristellpa):",Val jupasti (@ Vientino) jach 'a phunchhaw amtañaxatw arst 'i:
"Severas tormentas de invierno azotaron a la mayor parte de Israel la semana del 13 de dic 2010, con fuertes vientos, lluvias y tormentas de nieve causando caos en todo el país.",Juyphi pachan jallu purintatapa 31 jallu qallta 2010 maranx wali thaya wayramp jallump khunumpix Israel markpacharuw jan walt ’ awaykiti.
Cantando el himno nacional en su propio idioma,Kipka arupan himno nacional jayllintawi
Fuerza policial del aeropuerto de Rangún se une a la protesta.,Fuerza policial aeropuerto Rangún uksatax chikancht 'asipxiw uka saratasiwinxa.
Buscar el hogar digital correcto para tu contenido de audio puede ser un reto difícil con el amplio rango de opciones y bondades disponibles.,Mä digital kunayman luräwinaks waruqt ’ añamataki.
"En fin, eso es todo en nuestro primer podcast del año.","Dinamarca-nxa, kawkhantï uruchasi ukjan Maria Grabowski Kjaer-ax markachirin arst 'äwinakap yatiyäna."
"En el documental Hikes of Courage: Climbing Chirripó in 1960, un equipo de hombres y mujeres jóvenes realizan una larga expedición para alcanzar el pico más alto de Costa Rica.","Sarnaqäwin qamasapa: 1960 mar Chirripó qullur makhatäwi, Costa Rica jach ’ a qullur puriñtakix waynanakamp tawaqunakampiw qalltapxi."
"El ministro de Planificación Federal, Julio De Vido, aseguró que “otra vez la falta de gestión ” del gobierno de Mauricio Macri“ nos lleva a lamentar víctimas fatales y deja a 450 mil vecinos sin luz ""en la Ciudad.","Ministro de Planificación Federal, Julio De Vido, Mauricio Macri uka irpirikan uka maranakanjam jan walt 'äwix utji sasaw amuyt 'i."
Foto cortesía de @homePhotography por Jerry,Foto cortesía de @ homePhotography por Jerry
@pemex: Lamentablemente se tienen confirmados al momento 14 personas fallecidas y 80 lesionadas,"@ pemex: Llakiskañawa, jichhakamax tunka pusin jaqinakaw jiwata ukat kimsaqallq tunka usuchjatanakaw utji."
Bolivia: Cholitas guerreras bajo los reflectores,Bolivia: Pulliran warminakan nuwt 'asiwip uñacht 'äwi
"Los centros rurales de información, los modelos tradicionales de comunicación y la radio son canales mucho mejores.","Kampun yatiyäwinakaxa, utt ’ at yatiyäw uñacht 'äwinak ukhamarak uxurinak juk ’ amp askinakawa."
Peruanos triunfan en sus categorías en la Maratón de México,Perwanunakax categorías Maratón de México ukan atipjasinw wali kusisipxi
"Ahora bien, el INDOTEL asegura que un recorte presupuestario de casi un 50% es una de las principales razones de esta medida, además de algunas estadísticas desalentadoras con relación a la efectividad del programa, como son: De los 2,163 estudiantes de esa institución, 1,062 (47%) desertaron o perdieron el beneficio de la beca por no mantener los índices requeridos.","ukanaka. Jichhax, INDOTEL ukaxa yatiwayapxiw sasin chikat qulqikiw churatani kunalaykutix janiw suma askikit wayn tawaqanakataki ukampirus walja mutivunakaw utji: 2,163 ukja yatiqirinakatx, 1,062 (47%) ukjanakaw mistawapxi becatxa kunatix janiw atipañ putkaxataynati. päqallqu maranx mistawayapxiw 20% ukha yanapt ’ atanaka."
Ecuador lucha contra la violencia deportiva,Ecuador markanx anatäwin yanqhachäwinak utjk ukxatx ch 'axwaskakiwa
"En el post anterior introducimos brevemente el problema del agua en Iquitos, y luego expusimos la controversia generada por la exploración y búsqueda de hidrocarburos por parte de la transnacional Conoco Phillips en la cuenca del río Nanay.",Akan nayrïr qilqatanx Iquitos markan umar jan walt ’ ayirinakat qilqtan ukatx hidrocarburos transnacional Conoco Phillips cuenca Nanay jawirar jan waltäwinakaxata.
17 julio 2013 Activista adolescente Malala Yousafzai impresiona a la ONU y polariza Pakistán,17 uru willka kuti phaxsina 2013 marana Activista adolescente Malala Yousafzai jupax ONU ukaruw p 'arxtayi
El Movimiento Juvenil Libio afirmó:,Juvenil Libio sarakitaynawa:
"Como las estaciones del metro estaban cerradas, todos tenían que caminar hacia fuera de la zona de conflicto.","Estaciones de metro ukax jist ’ antätanwa, taqpachaniw anqaxar jan walt ’ awtuqit mistxapxana."
Brunei Style,Estilo Brunei
"Lo que pasó después fue el caso más grande de abuso por parte de la policía de la década: las tropas de choque especiales evacuaron las calles del centro de Río, desde el barrio bohemio de la Lapa, que está a 2,5 km de distancia.","Ukatx ukjam jach ’ a yanqhachaw pallapallanakan utjatapaxa: jan walt ’ awit wakicht ’ at tamanakax centro de Río ukan callenakapw ch ’ usa uñjañatak wakicht ’ asipxi, barrio bohemio de la Lapa ukhata, 2,5 km ukha jayankiwa."
Lucio Uberdan del Brasil Autogestionário comenta:,Lucio Uberdan Brasil Autogestionário tuqitxa comenta:
"La noticia fue recibida con gran alegría por parte de ecologistas, organizaciones no gubernamentales y cientos de ciudadanos que habían mandado cartas al Poder Ejecutivo de la República para crear conciencia sobre una práctica terrible y dolorosa.","La noticia fue recibida con gran alegría por parte de ecologistas uksankirinakatx uka yatiyäwix wali askin katuqatawa, organizaciones no gubernamentales ukankirinakamp ukat marakchirinakampix Poder Ejecutivo de la República uksaruw mä carta qilqata apayapxatayna."
"Dos años antes, Hamshari, un sitio web iraní de noticias, escribió que ""internet nacional"" es un término ambiguo.",Jichhax walja bloquers uñt 'atanakaw uñt 'ayatäna que Sistemas Computarizados Corporativos de Irán jas ukanx satayna.
Mientras que en el sitio web de la iniciativa describen el objetivo de la jornada: 0 muertes violentas el día 2 de octubre:,"Ukhamarakiw sitio web tuqinxuñist ’ ayapxi kunäntix amtax uk, ukax sañ muniw ukur jan ma jiwayatas uñstañapa:"
@ThinkMexican: La explosión en la Torre de #Pemex se da días después de que @EPN respondiera a las especulaciones de que su admin. buscaba privatizar el petróleo de Mexico.http://ow.ly/1RJUGC,"@ ThinkMexican: Torre # Pemex ukax qhipa urunakaw phalläna, kunawsatix EPNx jayskan maysar arusirinakar ukja. priwatisañ Mexicon khusu umap thaqhäna http: / / ow.ly / 1RJUGC."
"No sólo el Gobierno Regional tiene un papel discutible en estos hechos; según el semanario La Verdad de Iquitos, resulta risible que el Comité de Gestión de la zona afectada esté presidido por ""Perúpetro (la que dio la concesión) y tenga como vicepresidente al representante de la Conoco Phillips,""",Janiw Gobierno Regional ukak aka luräwinakat arusipkiti; Iquitos markan La Verdad yatichäwirjamaxa
"En el hemisferio Sur el Sol alcanza su cenit al medio día sobre el Trópico de Cáncer, el 21 o 22 de junio.",Hemisferio Sur uksanx intin cenit ukapax chika ururuw Trópico de Cáncer uksan 21 ukat 22 uru willka kuti phaxsinw puri.
Los argentinos también recuerdan que durante la intervención quirúrgica realizada al ex-presidente Néstor Kirchner el año 2010 los familiares de Kirchner rechazaron que el emisario de Bergoglio le impartiera el sacramento.,"Argentinunakax kunapachati mistur Néstor Kirchner jilïr irpirix intervención quirúrgica ukankan 2010 marana ukat Kirchner ukan wila masinakapax janiw sapxanw ukwa amtapxi, Bergoglio jupax sacramento yaticht 'ani."
"En un esfuerzo por ampliar esta conversación, pensamos que podríamos intentar tener una charla en tiempo real mientras los juegos están en curso.","Mä ch ’ amt ’ awiw aka aruskipaw jilatatayañaxa, anatawinak thakhinkipanx aruskipawix inas yant ’ atachisp sasaw lup ’ ipxta."
"El último Inti Raymi celebrado por los incas tuvo lugar en 1535, después del cual la Iglesia Católica y la Conquista española le pusieron fin.","Maysatsti iglesia Catolica, español q ’ ara jaqinakax tukjañrak munawayapxatayna."
"Según diversas fuentes, incluidos los miembros de su familia, la policía llamó a Jean Laokolé... supuestamente sobre un artículo publicado en un blog.","Kunayman qillqatanakarjamax wali masinakapamp pallapallampix Jean Kaokolé ukaruw jawsapxi, qillqaw qillqatapata."
"@MaryFitzgeraldIT: Tras un día de rumores, el portavoz del congreso nacional de #Libia ha declarado en un canal de TV local que Khamis, el hijo de Gaddafi había sido capturado y herido y ha fallecido hoy","@ MaryFitzgeraldIT: akürun arusïwitxa, # Libia markan congreso nacional ukan arst 'iripax TV uksan Gaddafi ukan Khamis yuqapax katjatataynaw ukat usuchjata ukhamakipansti jichhüruw jiwxi sasinw arst 'i."
"Orador: Juan Ernesto Luna Ulloa (El Alto), Coordinador Nacional de la red Juventud Diversa Boliviana","Arxaytiri: Juan Ernesto Luna Ulloa (Altu pata markata), Coordinador Nacional de la red Juventud Diversa Boliviana uka tamankiriwa."
"Se puede esperar que en el futuro cercano muchos de nuestros contratistas vayan con Gaddafi, que tiene gran confianza en los soldados serbios.",Ukjamarus wali jaya maranakaw pallapallapxatayna. … ¡Gaddafi jaqix qawqhtix mayipkix ukjrak paylliritayna!
"Continuando con las indagaciones colectivas bajo la etiqueta de #QRBolivia, el blogero Mario Durán de El Alto se puso en contacto con el Servicio Nacional de Propiedad Intelectual (SENAPI) y representantes de la compañía.","Sarantataskakiw qutucht ’ asis aka # QRBolivia, ukjam sutin uñt ’ atat yatxatañataki, ukatx Alto pata markankir bloguero Mario Durán jupasti Servicio Nacional de Propiedad Intelectual (SENAPI) ukampix mäkirakiw yatiyasixpxi ukat mayni lantinakampis ukakipkaraki."
"El acontecimiento, organizado por el Ministerio de Educación, reunió educadores, alumnos y otros interesados en promover el uso de las 13 lenguas nativas de Malí.","El acontecimiento, organizado por el Ministerio de Educación ukat jawillt ’ äwix yatichirinakar yatiqirinakar ukat yaqhanakampir tantachthapt ’ i, Mali markan 13n tayka aru sarantayañataki."
"Tuve una profunda sensación de pesar que me ahogó, sentí el dolor de los familiares del pequeño William, el dolor de perder a alguien querido.","Walpuniw chuym ch ’ allxtayitu, chuymaw usut kunjamti William wila masinakar uskkpacha ukhama, mä wali munatar wawar chhaqayaña."
"En un fragmento de la carta se dice lo siguiente: Personalmente no he hablado mucho antes sobre el caso de Sarah Elmesallati y decía ""Ella tuvo que ser informada de otra forma"".","Mä chiqanax akhama sasin si: Personalmente no he hablado mucho antes sobre el caso de Sarah Elmesallati y solía decir ""Ella tuvo que ser informada de otra forma""."
"El impacto medioambiental de la carretera es otro problema que genera protestas, particularmente entre la clase media y urbana de Bolivia.",Uka thakhi lurañ amtax qhurut arsusuiwinak uñt 'ayi.
(Noticias de Canyu el pasado 16 de septiembre) Esta mañana se realizó la gran manifestación contra Japón en el centro de Shenzhen cerca a Huaqiang North y el Centro Ciudadano.,"(tunka suxtan uru saraqkäna sata phaxsina, Canyuna yatiyäwipa) jichharmantix Shenzhen markanx niya Huaqiang North uka jak ’ a taypi markanxa jach ’ a unxtasiwinakaw Japontuq sartasipxana."
Alberto Medrano comparte dos videos de mujeres aymaras en El Alto trabajando en minibuses como voceadoras: mujeres que anuncian la ruta del vehículo y cobran el pasaje a los pasajeros.,"Alberto Medrano jilax pä (video) waraqatwa uñt 'ayi, Altu pata markan aymar warminakan minibus k 'añaskun voceadoratjam irnaqapxatapata: warminakax arnakasipxiw kawkhat kawkhakamas saran taqi uka ukatx pasajirunakarus pasajs mayipxarakiwa."
"A las 3:00 pm, la masiva congregación en la capital de Bangladesh, Dacca, empezó a cantar el himno nacional.","3 jayp ’ u ursaruxa, Bangladeshan, Dacca qamatuqin jach ’ a tantachäsiwix markan q ’ uchup qallant q ’ uchuntaña."
"Sin embargo, para Juan Sebastián muchas personas publican sobre el cacerolazo solo para ganar ""favoritos"" en sus tuits:","Tukuyañataki, Fuerza Común jupankirix akjam sasaw aka yatiyt 'äwitx arst 'araki:"
Conversando con Rebecca MacKinnon sobre “Consent of the Networked ”,Rebecca MacKinnon jupamp “Consent of the Networked ” ukxat aruskipasa
La tradición de servir ñoquis los dias 29 nace de una leyenda que se remonta al siglo VIII.,"Sarawinx ñoquis ukax sapa 29 ururuw manq ’ t ’ asiña, ukat mä jawarit VIII patak maranw uñstatapa."
El e-book cuenta con una licencia Creative Commons Attribution 3.0 y está disponible para descargarse en tres formatos diferentes:,Creative Commons Attribution 3.0 ukankiwa kunatix disponible para descargarse kimsa kastanakawa utji:
"Sin embargo, el carnaval también trae aparejado quejas de sus vecinos por el descontrol entre los asistentes.","Ukampirusa, carnawalax khitinakati jutapxk phunchhäw machantäwinak apaniraki.El Dia OnLine sarakiwa:"
Estén con nosotros!,Mayuru pachprakiki aka presidentejanakax lurapxitu.
El interrogador se rehusó a quitármelas.,Jiskt 'irix aparañ munitäna sasa.
"Kevin corrige el post, y queda publicado en el sitio de Global Voices en inglés.",Kevin qillqat uñt 'ayatya askicht 'i sitio Global Voices inglés uka aruna.
"Sin embargo, los medios búlgaros, con dos excepciones memorables -la agencia de noticias BGNES y el sitio de Internet Mediapool - no siguieron la iniciativa y siguieron incluyendo al Primer Ministro en sus artículos.","Juk 'ampinsa, khaysa medios búlgaros, jan ist 'asinxa- khaysa jach 'a uta yatiyirinakansa BGNES ukhamaraki khaysa sitio de Internet Mediapool - janiw arkapkatanti kuntix sapkana ukxa ukat jupanakax khaysa nayrir Ministrurux laphinakaparux qillqt ´ asiwayapkakitanawa."
Este es un dramático cambio de política.,Kax politican turkakipawipawa.
Aprender algunos elementos para plantear campañas o proyectos.,Amtanakar ch 'amancht 'añatak yatiqäwi.
Los que parecían exconvictos me ofrecieron algo de comer.,Yaqhipa exconvictos jupanakas ma juk ’ a manq ’ añ churapxitu.
"El Alto es un gran suburbio de la ciudad de La Paz, con una población estimada de aproximadamente 900.000 habitantes.","Altu markax jach ’ a markaw La Paz markatxa, niya 900.000 jaqiniwa."
"Todo el que tenga más de 9 años, una cámara y una idea para un vídeo de un minuto sobre el medioambiente, puede participar en el concurso que concede un premio de 300 dólares para producir un vídeo, con el cual competirá por un gran premio de 1500 dólares y la participación en la XVIII Conferencia Internacional sobre el Cambio Climático que tendrá lugar en noviembre.","Taqpach jilanak kullakanak llatunk jilir naraninaka, mä cámara utjininakamp mä amtawimp medio ambiente videotak mä k`atan ukanakaw concursur mantapxaspa. Atiristi 300 dolares mä video lurañatak apasïni, Ukhamarak jupax 1500 dólar apasiñamp XVIII conferencia internacional sobre el cambio climático ukapmpir sarañatak yaqhanakamp yant`aniwa, akax noviembre phaxsin wakisini."
Egipto: Khaled Said - Un asesinato de emergencia por una Ley de Emergencia,Egipto: Khaled Said mä jank ’ a jiwayawi mä jank ’ a kamachlayku
El resultado es que los delitos aumentan y el silencio oficial continúa.,"Daniela Lopez, amuyt ’ iw aqiw siwa ukanxa:"
'Bolivia te espera' es el nombre de la nueva campaña promocional lanzada recientemente por el gobierno de Bolivia.,Jichhakiw Bolivia markan jilïr irpirix 'Bolivia te espera' sutin machq campañx apsuwayi.
"Una de las primeras expediciones en 1960, y una caminata hasta la cumbre en nuestros tiempos.","Mayïr uñichäwinakax 1960 mararuw kutti, ukat mä qullu patar saräwirakiwa."
Este post es parte de nuestra cobertura especial Europa en Crisis.,Aka post mä kubirtura especial ukankiwa Europaw markax chaxwawin.
"Ahmed Shafiq, el Primer Ministro del ex presidente Hosni Mubarak, se enfrentó contra el candidato de la Hermandad Musulmana, Mohamed Morsi en la ronda final.","Ahmed Shafiq tatax Hosni Mubarakan nayrir Ministrupanwa, jupax Mohamed Morsimpiw atipt ’ asiwiruw mantatayna."
En la ciudad de Bogotá se realizó un evento con la participación de varios músicos y artistas nacioales e internacionales que se pudo seguir via streaming.,Bogotá markanx ma phunchawiw músicos ukhamarak artista ukanakampiw aka via streaming. tuq nayrar akham sutimp sartayapxi
Lo próximo que intentarán es filtrar los pensamientos de las personas,Ukjarux jila kullakanakan lup 'ïwinakap jamasat apaqañ yant 'apxani.
