target_sentence,source_sentence
"Por si fuera poco, en el partido del pasado 16 de marzo, donde se enfrentaron San Lorenzo de Almagro y Colón de Santa Fe, los jugadores de San Lorenzo lucieron una camiseta conmemorativa al papa Francisco.","Ukjamakasinsti, pasiri tunka suxta uru aka achuqa tukuya phaxsita, anatt ’ awayapxiwa San Lorenzump Colón de Santa Fe, San lorenzunkirinalkax anatañ isispanakapamp Francisco tatakurar jallallawayapxi."
"Mike, en su blog sobre Bogotá, postea imágenes de la navidad en La Casa del Colibrí, que ""apoya a muchas familias pobres que viven en el centro de Bogotá - en particular familias que fueron desplazadas cuando el viejo barrio Cartucho fue destruido para crear el Parque Tercer Milenio.""","Mike, Bogotá markxat blogupan Colibrí ukan utapat navidadat videonak uñt 'ayi, Bogotá markan pisin jakir wila masinakaruw ch 'amancht 'i - barrio Cartucho satak ukan jan walt 'ayat uñjask Kimsir Parque Milenio utt 'ayañatak jas ukanatakiw jilapachax ch 'amancht 'i. """
"Los venezolanos votan hoy 26 de septiembre para renovar toda la Asamblea Nacional -el cuerpo legislativo monocámara que sustituye a lo que antes era el Congreso- y en la red, docenas de personas han estado haciendo y remezclando videos para invitar a los ciudadanos a votar.","Venezulanunakax jichhüru 26 urun sata qalltan chhijllapxi, Asamblea Nacionalar machaqat tukuyañataki, (legislativo monocamara) astas nayra Congreso ukaruw lantinchi, red ukansti walja jaqinakaw videonak ch ’ arqthapisipkatäna, markachirinakar chhijllañ jark ’ añataki."
Presentación: La evolución de El Alto digital,Uñt ’ ayäwi: La evolución de El Alto digital ukham sutincht ’ ata
"El propio Psy, la sensación K-Pop, pidió que les devolvieran su empleo.",Psy-x jupanakan irnaqañ wasitat jikxatapxañapatakiw ch 'amt 'äna.
"Candy junto a su papá, Maminirina Radifera Ranaivoson (Izquierda); Leonard Chien, Director de Global Voices Lingua; y el Arzobispo John Baptist Odama de Uganda, uno de los ganadores del Premio Breaking Borders","Aka jamuqansti, tatapa, Maminirina Radifera Ranaivoson; Leonard Chien Global Voices arut aru jaqukipir irpiriwa; Archbishop John Babtist Odama, Uganda suyuta, khititix Breaking Borderatipawayki"
"El blog de fotografia de Amelia McGoldrick publica una selección de imágenes, no solo del carnaval sino de sus días como turista en la ciudad.","Amelia McGoldrick jamuq blog-anxa; ajllirt ’ at jamuqanak uñacht ’ ayi, janiw carnawal urunakatakïkiti jan ukax kunanakas uñakipañ markan ukanak kunw uñacht ’ ayi."
"Una vez que el contenido es subido la apariencia del artículo se asemeja al del periódico ABC Color, pero tiene una aclaración al pie que señala que el sitio contiene noticias falsas y contenido creado por el usuario.","Apkatatx ABC Color yatiyäwjamaw uñjasi, ukampisa aynachjaruxa uñstiw mä qhanancha, ukanx siwa aka chaqanx utjiw jan chiqa yatiyäwinak ukhamarak uñakipirin luratanaka."
"El hecho de que el terrorista apuntara a Japón y Corea del Sur como ejemplos claros de países que desechan de forma consistente y directa el multiculturalismo, ha generado varias respuestas en Corea del Sur.","Uka terrorista ukax Japón ukatx Corea del Sur uka markanakaruw qhanpach uñacht 'ayi, ukampirus Corea del Sur uksampun jilpachax utji."
"Algunos de los activistas recibieron computadores portátiles (laptops), grabadoras de audio digitales y cámaras de vídeo digitales, trípodes, auriculares con capacidad de anular o disminuir el sonido ambiente y discos duros externos para usarlos en su trabajo.","Yaqhip activistanakax computadores portátiles (laptops), grabadoras de audio digitales ukat cámaras de vídeo digitales, trípodes, auriculares ukat discos duros externos irnaqäwinakapan apnaqasipxañapataki."
"Se dice a menudo que los mozambiqueños empiezan el año ""marrabentando"".","Mara mozambiqueñonakax ""marrabentando"". qalltapx sasiwa."
Por lo general traduzco artículos de autores africanos.,Jilpachx Africanos markachirinakan qillqäwinakap jaqukipta.
"El próximo domingo 8 de mayo, los ciudadanos mexicanos marcharán para demandar el término de la ""Guerra contra el Narco"" y la dimisión de todos los oficiales del gobierno responsables de más de 35,000 muertes y del incremento de la inseguridad y corrupción.","Jutïr willküru 8 uru llamayu phaxsit saraqatarux mexicanos markachirinakaw ""Guerra contra el Narco ” uka aru chhaqtayañatak sartasipxani jan yaqäsiw utjatapata, 35,000 waranqa jiwatanakaw utji, inseguridadampin corrupcionampin jiljatatapalaku, jall ukaruw qhuru arump kutiyapxani."
La agitación de la multitud.,Waljanin ulluqïwi.
"O el periodista y escritor Raúl Tortolero (@raultortolero1), quien se pregunta:","Ukatx yatiyiri, qillqiri Raúl Tortoleroxa, akjam sasaw jiskt ’ asi: Raúl Tortolero (@ raultortolero1) qillqirix, jiskt 'asiwa:"
JA: ¿Algo más que añadir?,JA: Kunampch arxt 'awayasma?
Así que ahora los jóvenes de Abu Sir están usando la ofincina como salon de té y la mezquita ya no se usa para sus sermones fundamentalistas y nadie ha visto al grupo Takfir desde hace algún tiempo.,Jichhax Abu Sir tuqin waynanakax uka uta irnaqiritakix mä junt ’ um umasiñatakiw apnaqapxi ukat kumpurillax janiw mayisiñatak apaqapxi ukatxa janiw khitis Takfir tamarur uñjapkiti.
"Para seguir en directo los acontecimientos, siga #PrimaveraValenciana",Jaqtapxiwa mä taripawxama 11ni maranak jan markana magistradxama mantañapataki.
"Puente sobre Caño Tauca, un pequeño río que pasa por el campus, donde los alumnos pueden bañarse e incluso pescar.","Caño Tauca chaka patxana, campuschiqwa uka jisk 'a jawirax mäkipti, uka jawiranx yatiqirinakax jarisipxi ukhamarak challwanak katupxi."
"Espero que algún día cuando diga Soy gay, no sea acusado de ser un pecador o sea maltratado.","taqi chiqankaptwa "", aka YouTube, Facebook y blogs, tuqinakata aka uraqpachana chacha – warmipura axsarañ munasiñxata arsusiñataki."
La imagen subida por @m_mubher contiene una línea escrita por el poeta palestino Mahmoud Darwish: Hacemos lo mismo que hacen los prisioneros y los desempleados; Albergamos esperanzas.,Picture posted by @ m _ mubher has a line by Palestinian poet Mahmoud Darwish: We do what the prisoners and the unemployed do; we grow hope.
El tercer canal de Irán (que transmite la serie controversial) tocó música bajtiari varias veces hoy.,Iraní markankiri uka kimsir canalax uñist ’ ayiw bajtiari uka markan jayllawipa wal kuti ma urunxa.
"Eso es porque cada año, a comienzos de febrero, se lleva a cabo el festival más representativo del país, el Festival del Marrabenta.","Ukhamaw kunatix sapa mara mä jach ’ a phunchhäwiw markan lurasi, Marrabenta phunchhäwi."
"A medida que este crecimiento se encontraba con arroyos que desembocan al Río de la Plata se los entubaba, se rellenaba su cauce y a lotear que se acaba el mundo.","Qhantatix wali mulljaskayanwa, suxta pachaw uma apsupxana, kuna yänakap qhisphiyañataki, mayni markachirirux umax apasxanwa."
"Antes, se cazaba un hipopótamo y su carne se repartía entre la población para conmemorar la fecha.","Nayraxa, mä hipopótamo katupxan ukat aychap taqpach markachirinakar churapxan uka pacha amtañatakixa."
"El Dr. Tony Tan fue elegido séptimo presidente de Singapur el 27 de agosto, pero su margen de victoria fue de sólo 7.269 votos.","Paqalqür Singaporean jach ’ a mark irpirix lakan phaxs pä tunk paqalqür saraqataruw Dr Tony Tanar ajllisiwayi, ukampins atpt ’ äwipax 7,269 jaqunakampikïnwa."
"Los hablantes de Aymara son cada vez más activos en la web a través de proyectos como Jaqi Aru en El Alto (Bolivia) y, gracias a sus esfuerzos de traducción, Global Voices ya se encuentra disponible en Aymara.","Aymar arsurinakax sapakutis juk ’ amp p ’ arxtasirinakapxiw web tuqinxa, jisnawa Jaqi Aru Altu pata Bolivia markata, jupanakan aru jaqukipaw (traducción) chamt ’ awinakapampix, Global Voices ukanx Aymaran qilqatax utxiwa."
"Importa todo lo que vimos, pero mucho más lo que no vimos.",Taqi uka jan walt ’ awinakatx uñch ’ ukiripxtanwa.
"La etiqueta #SiVotastePorBachelet comenzó a ser tendencia en Chile durante el día de las elecciones y lo sigue siendo hoy, un día después de la votación.",La etiqueta jumatix Bachelet jupa kullakaru chhijllawayta ukaxa akax wal chhijllaw urunx apanaqatanwa ukhamarakiw jichhurunakanx chhixllaw tukutatx apnaqasiski.
El bloguero Mahmood Al-Yousif reflexiona sobre este Día de Duelo en su último post:,Mahmood blogerux Al-Yousif qhipïr post qilqatanx ch 'axwaw urut amuyt 'asaw qilqt 'i:
"Flashmob en Berna, Suiza:","Flashmob Berna uksana, Suiza:"
"El proyecto Blogger Swarm tiene por objetivo poner a la juventud a la vanguardia en los temas de discusión acerca de la justicia climática y alimentaria, los problemas en los cuales estos activistas están centrando su trabajo e investigaciones.","Blogger Swarm-ax waynanakaruw kunaymantuqit aruskipt 'apxañapatak nayrar ucht 'i, nayrar sartayirinakax luräwinakapamp thaqhäwinakapam nayrar sartayasipki."
Sigue perdido.,Chhaqhatakiskiwa.
"Ella se refiere al profesor e ingeniero caleño Julio Alberto Ríos Gallego, más conocido como el ‘ Profe Julio ’ en YouTube, donde es muy popular (casi una especie de estrella), y lo que es poco usual, en un campo tan a primera vista poco atractivo para los usuarios de esa plataforma como es la física y las matemáticas.","Jupax yatichiri ukat ingeniero caleño Julio Alberto Ríos Gallego, juparuw chiqancht 'i ‘ Yatichiri Julio ’ ukham YouTube ukan uñt 'atawa, plataforma kunjamas física ukat matemáticas ukanakax ukwa uñt 'ayi."
Arriba las criaturas de nuestros mares!,Jach 'a Lamar qutan uywanakax jach 'anchatapana! biodiversidad uka jakäwix jan jask 'atañapa! # CR
Son muchos los periodistas que no aceptan las declaraciones del ministro.,Uka pachparakiw wakiyata mä millón takanaka (qullqi Bangladesh) purtirun uñstañapataki.
"Al respecto David Órdenes, coordinador del Movimiento Movilizándonos, comentó para Global Voices que están demandando una ley universal de derechos enfocada más bien en los niños y jóvenes: ""de manera de que esta sociedad desde ahora cumpla con los niños, porque ellos son democracia y actores sociales... y por lo tanto la marcha de todas las marchas tiene que ver con que estamos atentos y haciendo propuestas.""","David Órdenes, coordinador del Movimiento Movilizándonos, ukax Global Voices ukatakiw arst 'i, jupanakax mä ley universal de derechos wawankatak waynanakatk mayipxi sasina: """
"@TutiFurlan: Hoy, antes de exigir #Paz debo revisar si yo la estoy dando, si la estoy viviendo, si la estoy promoviendo en cada paso que doy! @24_0","@ TutiFurlan: jichhür janïr # Paz uka maykasinx nayraqat nayax uñjañajaw mayt ’ awixa, ak jakaskti, sapa ch ’ amanchawint nayrar sartayasktxä @ 24 _ 0."
Pero también la tradición fue mas allá de las comidas.,aräwix manq ’ añanakatsipans juk ’ amp jayaruw sari.
"Segundo, hagamos que nuestros niños regresen al colegio.","Payïrinxa, wawanakasa yatiqañ utar kutt ’ ayapxañani."
"""Hablé con su padre en Damasco"", me dijo el líder.",Ukham jist`asixat jilir irpirix situ: “awkipamp Damasco uksan aruskipanim”.
Las cifras oficiales del referéndum dadas a conocer el lunes 7 mostraron que el 98.83% de los electores del sur eligieron separarse del norte.,Markaru jiskt ’ awixa pasiri lunes uruwa uñicht ’ ayawayi 98.83ni% ukhaniwa jaqunt ’ awapxi alaya tuqit t 'aqaqtaniñataki.
"Debido a que las mujeres continúan enfrentando los abusos y ataques violentos por buscar educación, se necesita mucha valentía para ser una colegiala en Afganistán.",Imill wawanakax yatichaw jikxatañ munasinx jan walt 'ayatapxiwa.
Los niños también participaron en la protesta.,Wawanakax ukhamarakiw arst ’ äwin yanapt ’ apxi.
"Este es un resumen de las reacciones a los resultados del referéndum. Dos hijos del luchador por la libertad de Sudán del Sur, Gordon Muortat Mayen Mabor, sostienen sus fotos mientras esperan efectuar su voto en el referréndum por la independencia de Sudan del Sur en Londres, UK.","Aka Sudán del Sur tuqinwa jan uñisisiña arxatirina pä wawapawa -Gordon Muortat, Mayen Mabor- jupanakawa jamuqata imata uñicht ’ ayasipki, janira voto jaquntkasina aka Sudan del Sur t ’ axtañataki aka Londres uka markana-UK."
"En los últimos días se han compartido distintos videos que señalan la posibilidad de un desastre ambiental, y se han discutido posibles soluciones o medidas de prevención.",Qhipürunakax taqikast videonak uñachapxi. Ukat uk askichañatak phiñasipxatayna.
"Perú: ""Iquitos necesita Internet veloz.","Perú: ""Iquitos markax Internet mayi."
"Foto de la autora, Cristina Quisbert.",Cristina Quisbert kullakan jamuqata.
"Los ""agricultores"" a los que el Sr. Presidente quiere proporcionar teléfonos son agricultores de subsistencia que producen lo que consumen principalmente en sus casas.",“Yapuchirinaka ” khitinakarut Irpirix jawsañanak churañ munix yapuchäwit jakirinak utanakpanak manq ’ añatak achuyapxi.
"Dije siempre que detrás de esas fotos no había nada, y que esas fotos eran eso, unas fotos, y dije también que estaba dispuesto a seguir explicando y explicar todo lo que se me plantease.","Aka jamuqanak qhipaxanx janiw kunas utjkant saskapuntwa, uka jamuqanakax ukanwa sasa, mä jamuqanaka, ukat saraktwa, nayax iyawatw qhananchas arkiri, taqikun amuyt ’ at yatiyañataki. yatitaxiwa, jutir pachürunx saraw Parlamenton uñstiri."
Él fue demandado por un restaurante por una reseña que publicó en su blog.,Jupax mä restaurante ukat demandatanwa blogupan mä reseña puwlikatapata.
Siria: Tanques entran en Hama en la víspera de Ramadán,Siria: Tanques sat illapt 'ir k 'añaskunakax Hama markaruw Ramadán uru purikpan mantapxi
"Si todos los participantes desempeñan su labor al 100%, Ségou Infos conseguirá tener una difusión mucho mayor.","TaqpachatiSi 100% ukha sarantayapachati, Ségou Infos ukax yaqha yanapäwinak thaskaniwa."
"El canal web multimedia TodoLoQueHay de Colombia publicó recientemente un corto viaje visual sobre un día en la reserva indígena Emberá-Chamí antes conocida como Christendom, cuyos habitantes tratan actualmente de hacerse conocidos por su nombre ancestral: Karmata Rua.",TodoLoQueHay Multimedia web jichhakiw Colombia-t Emberá-Chamí-n mä ch ’ usasïwit apkati khithinakatï Karmata Rua-mp uñt ’ ayaskapayax achachilanakapan sutinakapamp uñt ’ ayasiñ yant ’ aski.
El blog La Oveja 100 informó el lunes 4 de febrero:,Blog La Oveja 100 sutinix phaxsüru 4 uru anata phaxsin yatiyi:
"La acción se coordinó a través de la cuenta de Weibo @随手送书下乡, que significa ""lleva tus libros al campo"".","Weibo ukan cuentapampiw luräwix saranti @ 随手送书下乡, ukax sañ muniwa, pankanakam pata tuqir apama ""."
"Los clips son etiquetados y cargados en el servidor, alojado por la Universidad de Swarthmore, donde en la base de datos se ponen en paralelo y muestran la palabra en la lengua indígena, inglés y español.","Clips ukanakax Universidad de Swarthmore, ukan yanapt 'asita, kipka aruna, inglés, castellanu arunakan ist 'asi."
"Wikitongues es un nuevo proyecto con el que se espera documentar los 7,000 idiomas del planeta.","Wikitongues ukax machaq amta-wakichäwiwa, ukat uraqpachan 7,000 arunak qillqantañw suyi."
¡Comparte tu mundo con nosotros para que podamos compartir también contigo!,Nanäkamp ist 'apxama!
Un grupo de madres en huelga de hambre conmemoraron el Día de la Madre afuera de la oficina de Procuraduría General de la República en Ciudad de México y exigieron que el gobierno mexicano cumpla su promesa de buscar a sus hijos desaparecidos.,Mexico markanx mä tamacht ’ at taykanakaw Procuraduría General de la República uka uta anqaxan huelga de hambre lurapxätana taykanakan urup amtasa jupanakax mayipxätanaw gobierno mexicanuru phuqhañapa amtäwipampi chhaqhat wawanakapar thaqaña.
"A medida que los presentes se despertaban y se ubicaban en sus asientos, un cuarteto de músicos, el grupo Sheru ni Sheru, marchaba hacia el escenario tocando el tambor y bailando al compás del llamado de la mañana.","Qhantati 9 pacharux taqiniw qunuñanakar qunt ’ asxapxäna ukatx Sheru ni Sheru, uka jayllintiri tamaw mant ’ anisin jayllint ’ apxäna."
@KhaosXI: No se sorprendan si en uno de estos nuevos billetes de 200.000 o 500.000 nos encontremos con la cara de Lino Oviedo impresa en uno de ellos.,"CALACNN: Chuyma ch ’ allxtat wila masinakar ukhamarak Lino Oviedo arkirinakaru, khitimpiti aruskipayata nayra suxtürunakaki @ CALACNN."
"Hasta la fecha, esta declaración ha sido firmada por más de 1300 organizaciones y empresas, y este número sigue creciendo.",Anchhitkamax 1300 ukat jila tamaw rixuntawayxapxi.
"Estos videos se titulan ""La Leche y las Latas No Matan, el Hambre Si""","Juk 'ampis, nanakax ukpunxay umasipxstxa, sasaw arsusiwayapxatayna."
"Foto de Camilo Aldana para ICTJ, usada con su permiso.","Yoladis Zúñiga. Foto de Camilo Aldana para ICTJ, usada con su permiso."
Los congresistas que se opusieron a la ley en el primer debate recibieron fuertes críticas.,Congresistanakax nayrïr Kamachi ukarux janiw sapxänwa.
"En su discurso, pidió a los ciudadanos libios que salgan a la calle mañana y que vayan a por los “terroristas ” y se los entreguen a las fuerzas de seguridad, para que así puedan ser“ castigados con la muerte ”.","Ukatxa sarakitaynawa: arumanthix thaqhir mistsupxam, mark yanqhachirinak (terrorista) tuqi, ukatxa irpkatapxam aka fuerzas de seguridad tuqinkirinakaru “jiwayañataki ”, ukjamat juch uñt ’ ayañataki."
"Los que ayudan a elaborar esta base de datos para facilitar el acceso a la información son voluntarios denominados ""embajadores"", que se encuentran en Suiza, Zimbabue, Sudáfrica, Noruega, Rusia y España.","Ukanakan alaq ch ’ usat yanapt ’ asirinakax “embajadores ” ukjam sutincht ’ atapxiwa, ukat jupanakax khaysa Suiza, Zimbabue, Sudáfrica, Noruega, Rusia ukat España uksa markanakanw jikxatasipxi."
Personas de todos los sectores de la sociedad se unieron a la manifestación convocada por Casa Pueblo.,People from all sectors of civil society joined the demonstration.
El arte urbano está floreciendo en Irán.,Arte urbanux jaktaskiw Irán markana.
Vidal cree que dos funcionarios de gobierno del departamento de Tarija están detrás del ataque.,"Reportero sin Fronteras uksatx yatxatäwinx ""mä qillqata katjawayi"". Ukapachparakiw Farfán jilamp aruskipatax yatisi, ukatx sataynawa: Vidal yatiyirix pani irnaqirinakax uka yanqhachäwin nayraxapankaskan sasniw lup 'i."
Farfán confirmó que la familia comparte esta teoría en su cuenta de Facebook.,Farfán yatiyirix wila masinakapax Facebook ukan uñt 'ayasipki sasinw uñt 'ayawayi.
"Aún así, el gobierno de Bolivia insiste en los beneficios de una carretera que uniría la zona central del país, a partir de donde se mproduce la mayoría de coca ilegal, y donde Evo Morales busca apoyo de las bases.","Ukhamasa, Bolivia apnaqirinakax thakhi luräwix kuna askis kunatix chinthaphispaw marka taypiwjampi saskapxakiwa, qalltas kawkhanti juk ’ amp kuka yapuchapki, ukhamarak kawkhanti Evo Morales jilax ch ’ amanchäw thaqki."
"De hecho, como nativos digitales -alguien para quien las tecnologías digitales son fundamentales en la vida, ustedes están afectando directamente la vida de muchos, a veces incluso sin saberlo.","Sapa kutiw Internetamp machaq uñstir apnaqäwinakampix jiljatawayi, uraqpachax jisk ’ aptaskiwa; sarawisaru, jakawisaru, redes satanakar conectatatänwa, jumanakaru, aka turkakiptawirux chikanchasipxtawa."
"Felicidades a Bachelet y Matthei. Viva Chile! — Julio Arriagada (@Julioarriagad) November 17, 2013",Jallalla kullaka Bachelet ukhamaraki Matthei. jallalla Chile! — Julio Arriagada (@ Julioarriagad) tunta paqallqun urur saraqatapat lapaq phaxsita aka pä waranqa tunka kimsam marata
"El ministro cree que aunque muchos agricultores nigerianos son analfabetos, son capaces de utilizar teléfonos móviles:","Sullka Irpirix (ministro) walja nigerianonak yapuchirinakax janiw qilqañs ullañs yatipkiti, ukampirus apnaqkay jawsañanak atipxaniw apnaqañ amuyi:"
17 trozos de sabiduría de Nelson Mandela que todos debemos leer,Nelson Mandelan 17 tama arunak taqin ullarapxañäni
Nube de Palabras de Representación por Países - Haz clic para agrandar la imagen.,Markanakan sutinakapawa - Aka jamuq jach 'aptayañatakix limt 'ama (clic).
Filipinas: Drama de los rehenes termina en violencia,Filipinas: Jist ’ antatanakan yanqhachawipax tukusiwa
La conferencia de prensa fue transmitida en cadena nacional el domingo 28 de octubre ante una población expectante de qué podría decir el primer mandatario luego de un silencio solamente interrumpido por dos escuetos tuits.,Conferencia de prensax cadena nacional ukanw willküru 28 uru taypi sata phaxsin markachirir uñt ’ ayasina tuits.
"Migración del Serengueti, Tanzania","Serengueti uksar sariri, Tanzania uksana"
"Representantes del Ministerio del Interior, Ministerio del Deporte, Federación Ecuatoriana de Fútbol (FEF), Asamblea Nacional, y los clubes Emelec y Barcelona han comenzado a trabajar para neutralizar los actos de violencia generados por aficionados y seguidores de equipos de fútbol de primera división.","Ministerio del Interior Ministerio del Deporte, Federación Ecuatoriana de Fútbol (FEF), Asamblea Nacional, ukat clubes Emelec ukat Barcelona Representantenakax qallantapxiw irnaqäw suti ch ’ am apnaqäw ch ’ amanchirinakan ukhamarak arkirinakan nayrir futbol anatäwin (futbol de primera división) jan utjañpataki."
"¿""Chat"" es una palabra sucia en Irán?",Iran-an Chat ukax jan wali aruti.
Este escritor continúa: Ella también dijo que somos un estado moderadamente religioso y personalmente tuve que subrayar la palabra moderadamente.,Aka qilqirix saskakiwa: Ella también dijo que somos un estado moderadamente religioso y personalmente tuve que subrayar la palabra moderadamente.
"Houmani, una canción simple con un título extraño y un video clip producido con bajo costo ha creado enormes debates estas últimas semanas...","Houmani, ukax jasa jayllawikiw ukhamarak mayj sutincht ’ ata ukampirus juk ’ a qullqimpiki video clip ukax lurt ’ atasa wal jaqinakar aruskipayawayapxi aka qhipa simananakanxa."
Arabia Saudita: Cuando llueve sobre mojado en Riad,Arabia Saudita: Riad satan juripatxar purjatki
"El candidato presidencial de centroizquierda Luis Guillermo Solís disputará con el candidato del partido de gobierno, Johnny Araya, en una segunda vuelta el 6 de abril, después de que Solís asombrara a muchos en este pequeño país centroamericano al llegar al primer en los resultados preliminares dados a conocer la noche del domingo.","Candidato presidencial Luis Guillermo Solís jupax atipasiniw Johnny Araya jupampi, segunda vuelta utjawaykani suxta uru saraqatar qhasiwi phaxsit urunxa, ñakijay Solís tatax atipawaychitanax nayrir elecciones ukanxa ukhamarakiw wal muspayawayani aka jisk ’ a centroamericano markaruxa."
El sitio Proyecto Ambulante describe el siguiente video:,Yaqhip artistanakax walja vidiyus ukanak lurawayapxi.
"Hubo una ligera controversia puesto que algunos países aparecían varias veces mientras que otros ni siquiera fueron mencionados, a pesar de tener candidatos que valían la pena.","Ukat mä jaqthaptaw mak utjana, ukjamatx yaqhip markanakax walja kutiw uñstana, ukat yaqhipax markanakax janiw aytatakansa, inas sariripanakax utjchi, ukas ukjamanwa."
La Red de Blogueros y Activistas en Línea ha estado encabezando estas protestas continuamente desde el martes 5 de febrero.,Bloguero-nakamp línea-an arnaqxirinakamp llikax (red) 5 urunak saraqkipan anata phaxsit saxra urutx sapüruw p ’ iqincht ’ i.
"Dice que un escolta shabiha fue asignado a cada soldado nuevo, para asegurarse de que no desertara.","Jan soldad sarxañapatakix mä escolta de shabiha sapa soldadotaqix utjäna, uk sapa mantiriruw churapxäna."
"Luego que los cibernautas se indignaran y molestaran por este claro acto de censura de una empresa privada, aumentaran la presión en Twitter e incluso el Partido Pirata argentino manifestara su preocupación, los proveedores de servicios de Internet desbloquearon el sitio Web.","Ukata uñakipirinak aka luräwitx aka jark ’ at tamat llakkäw luräwit wal thithipxäna, Twitter ukanx juk 'ampiw jilxati ukhamarak argentino Partido Pirata ukax llakitawa, Internet churirinakax aka sitio web ukatatw jan jak ’ xarakiti."
Además en Facebook esta imagen está siendo muy visitada:,Ukampirus Facebook ukanw aka jamuqax wali uñt 'ataski:
Radioteca - Un hogar libre y abierto para el audio,Radioteca – Inak waraqañataki
Bolivia: nueva campaña para impulsar el turismo,Bolivia: Machaq campaña ukax turismo ukar ch 'amanchañatakiwa
Sin embargo el bloguero Yaohaiying señaló (chi) que el llamado estanque artificial de peces (450 mu) está ubicado en la parte central de la pintoresca zona y está claramente definido en el artículo sobre la protección del Lago Oriental aprobado por el Ministro de Estado.,"Ukhamakipansti yaohaiying bloguerox uñicht ’ ayiwa (chi) (450mu) challwan estanque Artificial sat uñt ’ atax pintoresca zona chikataypin utt ’ atawa, Ministerio de Estadon jaysat Oriental qutar articulun jark ’ aqañjat qhana amtaxiwa."
¡Únete a nosotros!,¡Nanakamp chikancht 'asipxam!
"¿Es recomendable regular la cobertura de violencia de los medios? ¿de ser así quienes lo harían: los lectores, los medios, las ONGs o el gobierno?","khaysa Mexico markat nuwasiwinakatx, kuntix sutinchtan ""Wila wartawi narkutrafiku uka"" amuyayiwa jiwasan jan kuns yantanti uka ukhamaraki jilir irnaqirinakarus parlañataki akatxa."
